{
  "version": 1,
  "facets": [
    {
      "id": "0",
      "o": [
        0.0,
        -0.32,
        -0.34
      ],
      "u": [
        1.0,
        6.4e-05,
        6.7e-05
      ],
      "v": [
        0.0,
        -0.72396,
        0.689841
      ],
      "n": [
        9.2e-05,
        -0.689841,
        -0.72396
      ],
      "ext": [
        -50.6,
        5048.9,
        -50.6,
        3299.2
      ]
    },
    {
      "id": "1",
      "o": [
        -0.39,
        -2132.4,
        -102.23
      ],
      "u": [
        -0.008068,
        0.999967,
        -4e-06
      ],
      "v": [
        0.013269,
        0.000111,
        0.999912
      ],
      "n": [
        0.999879,
        0.008067,
        -0.013269
      ],
      "ext": [
        -49.6,
        2123.8,
        -50.2,
        2070.1
      ]
    },
    {
      "id": "2",
      "o": [
        4045.78,
        -15.69,
        5.36
      ],
      "u": [
        0.999967,
        0.008004,
        0.00133
      ],
      "v": [
        0.004874,
        -0.723597,
        0.690205
      ],
      "n": [
        0.006487,
        -0.690176,
        -0.723612
      ],
      "ext": [
        1003.4,
        1689.4,
        -51,
        2391.2
      ]
    },
    {
      "id": "3",
      "o": [
        -15.66,
        -12.44,
        -271.07
      ],
      "u": [
        0.999992,
        0.003892,
        3e-06
      ],
      "v": [
        7.1e-05,
        -0.018899,
        0.999821
      ],
      "n": [
        0.003891,
        -0.999814,
        -0.018899
      ],
      "ext": [
        -50,
        5752.2,
        -51,
        326
      ]
    },
    {
      "id": "4",
      "o": [
        5131.53,
        -1670.59,
        1678.04
      ],
      "u": [
        0.999958,
        0.009171,
        -0.000132
      ],
      "v": [
        -0.006095,
        0.675201,
        0.737609
      ],
      "n": [
        0.006854,
        -0.737577,
        0.675228
      ],
      "ext": [
        -49.5,
        498.9,
        -51.5,
        175.1
      ]
    },
    {
      "id": "5a",
      "o": [
        5710.9,
        -1637.19,
        -275.5
      ],
      "u": [
        -0.005997,
        0.999982,
        0.000239
      ],
      "v": [
        -0.00031,
        -0.000241,
        1.0
      ],
      "n": [
        0.999982,
        0.005997,
        0.000311
      ],
      "ext": [
        -50,
        2125.4,
        -50,
        2022.1
      ]
    },
    {
      "id": "6",
      "o": [
        5712.42,
        444.36,
        -262.89
      ],
      "u": [
        0.999984,
        0.00561,
        -7e-06
      ],
      "v": [
        -9.7e-05,
        0.018615,
        0.999827
      ],
      "n": [
        0.005609,
        -0.999811,
        0.018615
      ],
      "ext": [
        -50,
        607.8,
        -49.6,
        427.6
      ]
    },
    {
      "id": "7a",
      "o": [
        6278.98,
        440.4,
        -247.58
      ],
      "u": [
        0.022796,
        -0.99974,
        -0.000236
      ],
      "v": [
        -0.013527,
        -0.000544,
        0.999908
      ],
      "n": [
        -0.999649,
        -0.022791,
        -0.013536
      ],
      "ext": [
        -50,
        2246.6,
        -50,
        1972.5
      ]
    }
  ],
  "floorMm": -325.5,
  "boxLo": [
    -465.7,
    -2788.8,
    -475.5
  ],
  "boxHi": [
    6730.9,
    890.4,
    2675.9
  ],
  "params": {
    "slab_margin_mm": 100.0,
    "slab_back_mm": 60.0,
    "slab_front_mm": 250.0,
    "box_margin_mm": 400.0,
    "box_floor_mm": 150.0,
    "floor_band_mm": 450.0,
    "air_outside": true,
    "surround_share": 0.1,
    "fray_mm": 0.0,
    "fray_sigma": 3.0,
    "needle_len_mm": 60.0,
    "needle_ratio": 5.0,
    "spike_len_mm": 20.0,
    "spike_ratio": 3.0,
    "lonely_cell_mm": 50.0,
    "lonely_alpha": 2.0,
    "haze_alpha": 0.08,
    "haze_len_mm": 40.0,
    "wall_needle_len_mm": 60.0,
    "wall_needle_ratio": 5.0,
    "wall_behind_mm": 20.0,
    "wall_off_cos": 0.5,
    "wall_flat_mm": 30.0,
    "wall_needle_alpha": 0.2,
    "min_alpha": 0.02,
    "wallZones": true
  },
  "toWorldMm": [
    [
      1000.0,
      0.0,
      0.0,
      0.0
    ],
    [
      0.0,
      1000.0,
      0.0,
      0.0
    ],
    [
      0.0,
      0.0,
      1000.0,
      0.0
    ],
    [
      0.0,
      0.0,
      0.0,
      1.0
    ]
  ]
}
